{
  "contract_version": "1.0.0",
  "catalog_id": "adlc-packaged-loop-library",
  "updated_at": "2026-06-22T00:00:00Z",
  "templates": [
    {
      "template_id": "ci-triage",
      "title": "CI Triage Loop",
      "summary": "Classify failing CI runs, group repeated signatures, draft bounded fixes for deterministic failures, and escalate infra or unclear failures.",
      "category": "ci",
      "autonomy_claim": "assisted_loop",
      "job": "Inspect failed CI signal, classify the root cause, draft a safe fix when the failure is deterministic, and update the tracker with evidence.",
      "exit_gate": "The loop stops when failing CI has a classification, verifier evidence, and either a draft fix or a human escalation.",
      "semantic_intent_check": "The proposed fix must address the failing signal without weakening tests, disabling checks, or changing unrelated behavior.",
      "task_signals": ["workflow_run_failed", "nightly_ci_triage", "blocked_pr_ci"],
      "required_skills": [
        {
          "name": "systematic-debugging",
          "path": "skills/systematic-debugging/SKILL.md",
          "purpose": "Classify deterministic failures and avoid speculative fixes."
        },
        {
          "name": "ci-cd-pipeline",
          "path": "skills/ci-cd-pipeline/SKILL.md",
          "purpose": "Understand CI provider conventions and safe escalation boundaries."
        }
      ],
      "connectors": ["github", "linear", "slack"],
      "required_adlc_commands": ["sync-work-item", "queue-claim", "worktree-prepare", "run-phase qa", "queue-complete", "queue-escalate"],
      "required_schemas": ["loop-contract", "tool-registry", "work-queue", "work-item-sync", "loop-template-install-report", "token-budget"],
      "tools": [
        {
          "name": "github-ci",
          "description": "Read CI checks and post PR status comments.",
          "actions": ["observe", "run_tool", "escalate"],
          "side_effect_profile": "mutating",
          "permission_tier": "requires_approval",
          "available_phases": ["research", "qa", "pr_prep"],
          "outputs": ["ci_failure_signature", "pr_comment"]
        },
        {
          "name": "adlc-verifier",
          "description": "Run deterministic CI-equivalent verifier commands.",
          "actions": ["run_tests", "observe"],
          "side_effect_profile": "read_only",
          "permission_tier": "unrestricted",
          "available_phases": ["qa"],
          "outputs": ["loop-test-result"]
        },
        {
          "name": "adlc-sync",
          "description": "Append CI triage status and evidence to the stable work item.",
          "actions": ["run_tool", "escalate"],
          "side_effect_profile": "mutating",
          "permission_tier": "requires_approval",
          "available_phases": ["pr_prep", "engineer_review"],
          "outputs": ["work-item-sync"]
        }
      ],
      "feedback_channels": [
        {
          "after_action": "after CI classification or fix attempt",
          "observes": ["ci exit code", "failure signature", "rerun result", "tracker update"]
        }
      ],
      "stop_escalate_rules": {
        "max_iterations": 3,
        "no_progress_after": 1,
        "escalate_when": ["failure is not reproducible locally", "fix requires CI config or secrets", "same test fails with multiple unrelated signatures"]
      },
      "mandatory_floor": [
        {
          "id": "ci:required-local-verifier",
          "command": "bin/adlc run-phase qa --workspace . --verifier '<project ci-equivalent command>' --json",
          "coverage_tags": ["ci", "deterministic_verifier"]
        }
      ],
      "required_from_task_signals": [
        {
          "id": "ci:sync-current-status",
          "command": "bin/adlc sync-work-item --work-item .adlc/ci_triage_update.json --dry-run --json",
          "coverage_tags": ["tracker", "evidence"]
        }
      ],
      "safe_bail_state": {
        "state": "CI failure classified with evidence and no merge/deploy mutation performed.",
        "rollback": "Revert only the draft branch or abandon the queue claim.",
        "idempotency": "Stable failure signature and work-item external id prevent duplicate tickets."
      },
      "progress_signal": {
        "signals": ["new classification", "local reproduction found", "verifier result changed", "draft PR created"],
        "no_progress_rule": "Escalate after one fix attempt that does not change the failing signature."
      },
      "control_channel": {
        "supports": ["steer", "abort", "escalate"],
        "safe_checkpoint_required": true
      },
      "independent_truth": {
        "type": "external_command",
        "evidence": ["CI provider check result", "local verifier exit code"]
      },
      "redaction_posture": "Do not copy secrets, CI tokens, or full environment dumps into tracker updates.",
      "budget_guard": {
        "token_budget_ref": ".adlc/token_budget.json",
        "hard_stop_behavior": "escalate",
        "required_for": ["llm_action", "agent_loop"],
        "budget_exhausted_stop_reason": "budget_exhausted",
        "evidence_refs": ["operator supplies token budget before unattended CI triage"]
      },
      "gates": [
        {
          "gate_id": "ci-loop-contract-valid",
          "type": "schema_validation",
          "command": "bin/adlc validate-artifact --schema loop-contract --input .adlc/loops/ci-triage/loop_contract.json --json",
          "failure_action": "block"
        },
        {
          "gate_id": "ci-local-verifier",
          "type": "deterministic_verifier",
          "command": "bin/adlc run-phase qa --workspace . --verifier '<project ci-equivalent command>' --json",
          "failure_action": "retry_once"
        },
        {
          "gate_id": "ci-human-review",
          "type": "human_review",
          "command": "human reviews diff before merge, CI config edits, or test changes",
          "failure_action": "human_review"
        }
      ],
      "human_approval_points": ["merge", "CI configuration change", "test disablement", "secret or runner configuration"],
      "queue_seed_tasks": [
        {
          "task_id": "CI-TRIAGE-001",
          "title": "Classify current CI failures and draft safe fixes",
          "source_ref": "signal:workflow_run_failed",
          "expected_paths": [
            {
              "path": ".github/workflows",
              "kind": "directory",
              "reason": "CI evidence source only; edits require human approval"
            },
            {
              "path": "tests",
              "kind": "directory",
              "reason": "Verifier evidence and possible failing-test reproduction"
            }
          ],
          "verifier_refs": ["<project ci-equivalent command>"],
          "evidence_required": true
        }
      ],
      "runbook": [
        "Install the template, replace placeholder verifier commands, and bind the CI provider connector.",
        "Run queue-claim and worktree-prepare before a fix attempt.",
        "Run the CI-equivalent verifier and sync the tracker with classification and evidence.",
        "Stop at human review before merge or CI configuration changes."
      ],
      "no_overclaim": ["Does not prove production correctness beyond the configured verifier.", "Does not permit automatic merges."]
    },
    {
      "template_id": "pr-babysitter",
      "title": "PR Babysitter Loop",
      "summary": "Watch labeled pull requests, rebase or repair one deterministic failure, update the PR, and stop when CI is green or a human is needed.",
      "category": "pr",
      "autonomy_claim": "assisted_loop",
      "job": "Monitor PRs labeled for agent watch and perform only bounded maintenance actions with clear evidence.",
      "exit_gate": "The PR is green, updated with a blocker, or escalated after the attempt budget is exhausted.",
      "semantic_intent_check": "Maintenance changes must preserve the PR author intent and must not expand feature scope.",
      "task_signals": ["pr_labeled_agent_watch", "pr_ci_red", "main_branch_moved"],
      "required_skills": [
        {
          "name": "definition-of-done",
          "path": "skills/definition-of-done/SKILL.md",
          "purpose": "Keep PR readiness checks explicit."
        },
        {
          "name": "systematic-debugging",
          "path": "skills/systematic-debugging/SKILL.md",
          "purpose": "Limit repair attempts to deterministic causes."
        }
      ],
      "connectors": ["github", "linear"],
      "required_adlc_commands": ["queue-claim", "worktree-prepare", "run-phase qa", "sync-work-item", "queue-complete", "queue-block"],
      "required_schemas": ["loop-contract", "tool-registry", "work-queue", "work-item-sync", "loop-template-install-report", "token-budget"],
      "tools": [
        {
          "name": "github-pr",
          "description": "Read PR metadata, rebase, and post status updates.",
          "actions": ["observe", "run_tool", "escalate"],
          "side_effect_profile": "mutating",
          "permission_tier": "requires_approval",
          "available_phases": ["research", "code", "pr_prep"],
          "outputs": ["pr_status_update"]
        },
        {
          "name": "adlc-verifier",
          "description": "Run PR-scoped deterministic tests.",
          "actions": ["run_tests", "observe"],
          "side_effect_profile": "read_only",
          "permission_tier": "unrestricted",
          "available_phases": ["qa"],
          "outputs": ["loop-test-result"]
        }
      ],
      "feedback_channels": [
        {
          "after_action": "after rebase or one repair attempt",
          "observes": ["PR mergeability", "CI result", "changed file set", "review comments"]
        }
      ],
      "stop_escalate_rules": {
        "max_iterations": 2,
        "no_progress_after": 1,